,link,country,news_outlet,title,date,text
1616,https://lajornadanet.com/index.php/2020/10/28/nicaragua-aprueba-polemica-ley-que-castiga-noticias-falsas/#respond,nicaragua,lajornadanet,Nicaragua aprueba polémica ley que castiga «noticias falsas»,2020-10-28,"La oposición afirma que la ley pretende controlar y censurar a los medios de comunicación independientes y usuarios en las redes sociales que son críticos del presidente Daniel Ortega

El Parlamento de Nicaragua aprobó el martes una ley de ciberdelitos que según la oposición pretende controlar y censurar a medios de comunicación independientes y usuarios en las redes sociales que son críticos del presidente Daniel Ortega.

Hace menos de 15 días, la legislatura aprobó la Ley de Agentes Extranjeros, que establece espionaje en contra de las organizaciones no gubernamentales, según expertos consultados por la Voz de América.

La Ley de Ciberdelitos, o “Ley Mordaza”, como la ha llamado la oposición, incluye penas de dos hasta los ocho años de prisión para quienes el gobierno considere que comentan los delitos de “propagación de noticias falsas”, la divulgación de información confidencial de las instituciones del estado o el acceso no autorizado a las páginas web del gobierno, entre otras cosas.

El proyecto fue aprobado en el Parlamento, dominado por el sandinismo, con 70 votos a favor, 16 en contra y 4 abstenciones.

El diputado sandinista Carlos Emilio López, férreo defensor de la ley, dijo en el debate parlamentario que no se prohibirá el uso de las redes sociales, sino que se sancionará a quienes cometan los delitos estipulados en la ley.

“Se les acabó el negocio a los mentirosos, a los que son parte de la industria de las mentiras en las redes sociales, a los que crean y difunden falsas noticias creando alarma, temor, zozobra, afectando la estabilidad económica, el orden público, la salud o la seguridad soberana”, declaró López, y mencionó una serie de supuestas noticias falsas divulgadas en abril de 2018, durante las protestas contra el gobierno.

Además, mencionó ejemplos de cómo, según él, “se mintió con cifras escandalosas” relacionadas al número de casos de coronavirus en Nicaragua durante el punto más crítico de la pandemia en a principios de este año.

López también dijo que la ley acabaría con supuestas amenazas vertidas “por los medios electrónicos digitales o cualquier otro medio de comunicación” contra de simpatizantes al gobierno. “Eso ya se acabó. Nunca más odio en las redes sociales”.

Otro diputado oficialista, José Antonio Zepeda, negó también que la ley está atacando la libertad de expresión, e indicó que él tiene “derecho como ciudadano a que se le informe correctamente y se me dé a conocer la fuente de la información que esté basada en verdad”.

Ley busca acallar a críticos

Sin embargo, el diputado Maximino Rodríguez, jefe de bancada del minoritario partido Liberal Constitucionalista (PLC), señaló a la VOA que la ley tiene objetivos claros y políticos de cara a las elecciones de 2021, donde la oposición tratará de poner fin a 13 años de gobierno de Ortega.

“Las pretensiones de la dictadura es que a través de leyes puedan sancionar a nicaragüenses que no estén de acuerdo con sus sistemas. Con esta ley pretenden atomizar, acallar a los opositores que quieran reclamar sus derechos como lo establece en la Constitución nicaragüense”, dijo Rodríguez.

La diputada opositora Azucena Castillo también criticó la ley, señalando que a través del Parlamento se busca crear un marco de represión para los opositores, amparándose de causas justas como los delitos que se cometen por medio de las redes sociales.

“Esta ley viene a crear un marco, junto con otras dos leyes, de represión. Los marcos tecnológicos ya tienen sus sensores para detectar anomalías, sin embargo, lo que aquí se busca es silenciar a la ciudadanía y a la oposición. Tiene nombre y apellido esta ley”, dijo Castillo a VOA.

La Ley de Ciberdelitos fue consultada la semana pasada por medios y periodistas oficialistas, quienes solicitaron todo el peso de la ley contra quienes insulten o se burlen del presidente Daniel Ortega y de su esposa y vicepresidenta, Rosario Murillo, en las redes sociales."
1617,https://lajornadanet.com/index.php/2021/06/23/ortega-celebrara-el-42-aniversario-de-la-revolucion-sandinista-con-guerrilleros-disidentes-tras-las-rejas-y-exiliados/,nicaragua,lajornadanet,Ortega celebrará el 42 aniversario de la revolución sandinista con guerrilleros disidentes tras las rejas y exiliados,2021-06-23,"La arremetida de Daniel Ortega contra sus críticos incluye también a exguerrilleros que lucharon con él para derrocar al dictador Anastasio Somoza

La celebración del 42 aniversario del triunfo de la Revolución Sandinista que puso fin a la dictadura de Anastasio Somoza en Nicaragua tendrá una particularidad este 19 de julio. Parte de los exguerrilleros que protagonizaron papeles importantes en la historia del país, sumergido en una guerra en ese entonces, están encarcelados y acusados de traición a la patria.

En las últimas semanas el gobierno del presidente Daniel Ortega, quien permanece en el poder desde 2007, comenzó lo que se ha covertido en varias jornadas de arrestos contra sus críticos, incluyendo la disidencia sandinista que combatió junto con él para acabar con el somocismo por la vía armada en la década de los 1970.

Dora María Téllez, Hugo Torres y Víctor Hugo Tinoco son parte de los exguerrilleros que fueron arrestados la semana pasada por la policía nicaragüense, en lo que ha sido catalogado como “una venganza de Ortega” debido a que estos tomaron distancia del mandatario por lo que han catalogado como sus desmanes autoritarios.

Otros se han exiliado para escapar de la cárcel, como Luis Carrión, quien fue uno de los nueve comandantes del gobierno sandinista en los 1980 y luego se separó de Daniel Ortega para unirse al Movimiento Renovador Sandinista (MRS).

“Mi esposa y yo hemos salido del país para continuar la lucha por la democracia en Nicaragua y la libertad de todos los presos políticos”, escribió Carrión en su cuenta de Twitter este martes por la tarde.

Familiares de exguerrilleros sin información

Los familiares de los exguerrilleros sandinistas han denunciado desconocer la condición de salud en la que éstos se encuentras tras su arresto. Consideran que existe una “saña” y “venganza” con estos casos en específicos.

El ejemplo más claro es el de la familia del exvicecanciller Víctor Hugo Tinoco, quienes relatan que tienen días de estar tomando medicina para poder calmar sus nervios ante la falta de información sobre el opositor. Tinoco fue el último disidente sandinista que fue detenido el pasado 13 de junio en horas de la noche tras salir a un centro comercial privado.

Cristian Tinoco Parrales, hija del exdiplomático, apenas compartió con su padre tres semanas, tras haberse ido a vivir hace un mes a la vivienda, tras ser diagnosticada con cáncer.

“Lo que hemos vivido desde el domingo 13 de junio ha sido un verdadero infierno. Mi familia sufre bastante. No lo dejan ver, nosotros no tenemos garantía de que él está vivo. Ha sido muy difícil porque como familia queremos que por lo menos el abogado pueda cerciorarse de cómo está mi padre, que es un señor de 75 años de edad”, dice Tinoco Parrales a la Voz de América.

Aún en medio de la condición que enfrenta dice que saca energías para animar a su familia, compuesta en su mayoría por mujeres que vivieron el allanamiento que se dio posterior al arresto de su papá.

“Nos quitaron los celulares, laptops, tabletas y documentos de mi papá”, comenta Tinoco. “El allanamiento fue realizado con un exagerado grupo de las fuerzas policiales contra siete mujeres indefensas que estábamos en la casa. Una señora de 90 años, una enferma de cáncer”, lamentó.

A raíz del arresto a su padre, Tinoco Parrales ha tenido complicaciones de salud con el cáncer con el que batalla y que su padre le apoyaba emocionalmente durante el proceso.

“Los problemas afectan a tu entorno. Yo soy una paciente que he sobrevivido cáncer y he tenido metástasis, ahorita tengo metástasis a nivel abdominal y todo esto ha empeorado mi situación, se ha agudizado”, indica la joven, que señala que en Nicaragua “estamos ante un terrorismo de Estado” por la persecución contra críticos.

¿Cuáles son los argumentos del gobierno de Ortega

El gobierno de Nicaragua distribuyó a sus embajadas un documento fechado el pasado 13 de junio, y al que la VOA tuvo acceso, titulado “Nicaragua: en defensa de la soberanía nacional y el estado de derecho”.

Según la proclama, las investigaciones contra Cristiana Chamorro están basadas en el manejo que habría hecho de los fondos provenientes de agencias gubernamentales y privadas de Estados Unidos. “Por ello, cualquier intento de un actor nacional o extranjero de socavar una investigación de esta naturaleza, también debe considerarse en el contexto de la legislación vigente, y debe ser percibido como un ataque frontal contra los principios del respeto al Estado de Derecho, la Democracia, la Soberanía Nacional y la Libre Autodeterminación en Nicaragua”.

El gobierno de Ortega acusa en el documento a los opositores por “su lealtad al gobierno de los Estados Unidos de América”, y “exige que sean eliminadas todas las medidas unilaterales, coercitivas e ilegales impuestas a países, instituciones o individuos, reiterando que la aplicación de tales medidas en tiempos de pandemia eleva su ilegalidad al nivel de crimen de lesa humanidad”.

Apelando a la legislación vigente, el documento indica que la Ley No. 1055, “protege al Pueblo Nicaragüense contra los delitos de traición y conspiración sediciosa”.

«Campaña de terror»

Hasta este martes 23 de junio se contabilizan 20 personas detenidas por razones políticas, dentro de ellos empresarios, exguerrilleros, analistas políticos y en la última jornada de detenciones han sido arrestados periodistas.

Estados Unidos ha calificado las detenciones “como una campaña de terror” ejecutada por el gobierno izquierdista de Daniel Ortega, quien ha pedido a la comunidad internacional “el respeto a la soberanía y a los procesos judiciales propios del país”.

El analista político Enrique Sáenz ha dicho a la VOA que las exigencias de Ortega “están llenas de cinismo, patrañas y mentiras” pues cuando se estaba luchando contra Somoza, un representante del Frente Sandinista participó en una Asamblea de la Organización de Estados Americanos (OEA) gracias a que Panamá le cedió un espacio.

“El Frente aplaudió la resolución de ese entonces en donde se pedía la renuncia de Somoza. ¿Entonces, por qué en ese momento era buena la OEA y no es bueno ahora? Estamos ante una gran hipocresía”, criticó Sáenz."
1618,https://lajornadanet.com/index.php/2020/10/03/fotos-asedio-policial-a-lider-opositor-felix-maradiaga-al-reunirse-en-juigalpa/,nicaragua,lajornadanet,FOTOS Asedio policial a líder opositor Félix Maradiaga al reunirse en Juigalpa,2020-10-03,"El encuentro es para organizar los territorios de la Coalición Nacional, bloque opositor más críeble hasta el momento contra el FSLN

El líder opositor Félix Maradiaga sufre un fuerte asedio policial al intentar reunirse con grupos de oposición y autoconvocados en un municipio de Juigalpa.

Se reportan varios policias y paramilitares que intentan evitar el encuentro entre opositores al régimen sandinista. En las gráficas se pueden observar que los ciudadanos actúan de manera pacífica.

Leer también Nicaragua: Periodistas y familiares de manifestantes muertos rechazan “Ley Mordaza”

«El día de hoy vamos a una nueva actividad de la Coalición Nacional me encuentro bajo persecución policial al igual que otros miembros de esta organización que nos disponemos a seguir con el arduo trabajo de llegar a los territorios a seguir llevando el mensaje de unidad y organización que requerimos para hace frente a la dictadura. No nos doblegamos y seguimos adelante con el compromiso más fuerte que nunca», dijo Maradiaga.

Se conoce que hay gran cantidad de paramilitares que los vigilan desde lejos. Compartimos el momento…"
1619,https://lajornadanet.com/index.php/2020/09/11/periodistas-de-la-costenisima-temen-correr-el-destino-de-otros-medios-clausurados-en-nicaragua/#respond,nicaragua,lajornadanet,Periodistas de La Costeñísima temen correr el destino de otros medios clausurados en Nicaragua,2020-09-11,"Los reporteros han recibido amenazas de números desconocidos a sus teléfonos personales que les advierten que de seguir informando como lo hacen pasarán a manos del Estado

BLUEFIELDS, NICARAGUA – A las cinco de la mañana Kalua Salazar, jefa de prensa de La Costeñísima, una emisora del Caribe Sur de Nicaragua, se prepara para una nueva jornada de trabajo. Temerosa, camina rápido hacia su centro de trabajo para dar inicio al noticiero.

Las últimas semanas no han sido del todo buenas para esta periodista, después que trabajadores del gobierno la acusaron de supuestas injurias y calumnias. Patrullas policiales y civiles se apostan continuamente en las afueras de la emisora.

Kalua es la segunda periodista que ha sido demandada en La Costeñísima. Sergio León, fundador de la radio fue el primero, pero el proceso judicial no avanzó porque en junio de este año murió tras contagiarse de COVID-19.

“Lo mataron finalmente. El estrés y persecución lo convirtieron en una persona muy enferma”, lamenta Kalua, quien no duda en responsabilizar a agentes del gobierno por agravar la salud de su fallecido jefe.

La Costeñísima representa mucho para los habitantes del Caribe Sur de Nicaragua, a 300 kilómetros de Managua, por la diversidad con la que cuenta en su información. Sus noticieros son transmitidos en español, pero también tienen varios programas en dialectos indígenas, como misquito y rama kriol, para llegar a las comunidades de la zona.

A las 5:30 de la madrugada inicia operaciones este medio con un noticiero que es escuchado religiosamente por los lugareños en los mercados, tiendas y sobre todo en los hogares de las comunidades indígenas y afrodescendientes.

La emisora se encuentra en una zona casi céntrica de la ciudad. Su fachada da la impresión de que se trata de una casa particular. “Por temor, don Sergio nos ubicó aquí”, dice la jefa de prensa."
1620,https://lajornadanet.com/index.php/2021/09/24/muere-el-sacerdote-felix-mendez-de-la-parroquia-santa-teresita-del-nino-jesus-en-los-cedros/,nicaragua,lajornadanet,Muere el Sacerdote Félix Méndez de la Parroquia Santa Teresita del Niño Jesús en los Cedros,2021-09-24,"Van alrededor de 25 sacerdotes que pierden la vida en plena pandemia del coronavirus

La Arquidiócesis de Managua confirma a través de una Nota de Duelo el sensible fallecimiento de otro Sacerdote en Nicaragua, se trata del Diácono Félix Méndez.

Hasta el momento han fallecido casi 25 Sacerdotes y 99 médicos generales en el país, a pesar de esto el gobierno sandinista sigue promoviendo eventos masivos y ha aplicado muy pocos reglamentos para evitar conglomeraciones.

“La Arquidiócesis de Managua comunica el fallecimiento esta mañana de nuestro Diácono Félix Méndez, recién ordenado en el mes de Julio 2021 y realizando trabajos pastorales en la Parroquia Santa Teresita del Niño Jesús en los Cedros, Managua”, indica el comunicado.

Leer también: Revelan una grave consecuencia del covid-19 que es más frecuente de lo que se creía

“Su Eminencia Cardenal Leopoldo José Brenes, Arzobispo Metropolitano de Managua y el Clero Arquidiocesano envían sus condolencias a su Mamá Natividad de Jesús Méndez, a sus familiares, a su Párroco Pbro. Carlos Handal, a los sacerdotes formadores del Seminario Arquidiocesano Redemtoris Mater y Seminario Arquidiocesano La Purísima.

Sus funerales se realizarán de manera privada. Diácono Félix Méndez, Descanse en la Paz del Señor”, concluye el comunicado."
1621,https://lajornadanet.com/index.php/2021/07/30/nuevo-arresto-en-nicaragua-esta-vez-una-abogada-de-ddhh/,nicaragua,lajornadanet,Nuevo arresto en Nicaragua: esta vez una abogada de DDHH,2021-07-30,"María Oviedo ejerció la defensa en 2018 a decenas de manifestantes encarcelados por razones políticas

La justicia nicaragüense continuó el jueves la ola de arrestos que emprendió desde hace más de dos meses contra opositores, miembros de la sociedad civil, periodistas, empresarios y precandidatos presidenciales.

Esta vez fue detenida en horas de la noche la abogada María Oviedo, miembro de la Comisión Permanente de Derechos Humanos (CPDH), la última organización de este ámbito que mantiene personería jurídica en el país. Con ella ya son 31 las personas bajo arresto.

Oviedo, quien en 2018 defendió judicialmente a decenas de manifestantes encarcelados por razones políticas, fue detenida por una supuesta investigación en su contra por violar la Ley de Independencia y Soberanía, bajo la cual también ha sido encarcelados la mayoría de los opositores.

“Es un terrorismo de Estado”, denunció la directora del Centro Nicaragüense de Derechos Humanos (Cenidh), Vilma Núñez, quien trabaja recolectando denuncias sobre la crisis que vive el país en una oficina clandestina, en referencia a las acciones recientes del gobierno del presidente Daniel Ortega.

En declaraciones a la Voz de América, Núñez dijo que “no hay distinción de ninguna clase. Se lleva a la gente con el objeto de aterrorizar a la población. Este es un estado terrorista que está encarcelando a todo mundo”.

La abogada Oviedo fue sacada de la vivienda de su madre en la ciudad de León, a unos 90 kilómetros al norte de Managua, y posteriormente trasladada a una celda de máxima seguridad.

“Es parte de las agresiones que nos tiene sometido el régimen dictatorial de Ortega y toca resistir. Toda la gente tiene diferentes formas de reaccionar. Nuestra invitación es a luchar contra este miedo”, añadió Núñez.

Una ley que no establece penas

Por su parte el abogado y extrabajador del Poder Judicial Yader Morazán, hoy exiliado en Estados Unidos, compartió que es absurdo apresar a los defensores legales por ejercer su trabajo profesional.

Por otro lado criticó, que los arrestos se están dando, citando la Ley 1055, o Ley de Soberanía, la cual no establece ninguna sanción penal.

“La única sanción que establece es el no poder optar a cargos de elecciones popular que no es el caso de Oviedo”, expresó Morazán a la VOA.

Agregó que “la ley tampoco establece un proceso que justifique su secuestro, violaciones de domicilio y ocultamientos de audiencias secretas”, como ha sucedido con los más de 30 opositores detenidos.

“Por eso he dicho que esta nueva escalada represiva ni siguiera tiene apariencia de legalidad, a pesar de que ellos han creado un marco jurídico totalmente adverso contra personas que se oponen a las malas prácticas de esta dictadura criminal”, concluyó el jurista."
1622,https://lajornadanet.com/index.php/2021/06/25/corte-interamericana-ordena-liberacion-inmediata-opositores-detenidos-en-nicaragua/#comments,nicaragua,lajornadanet,Corte Interamericana ordena liberación inmediata opositores detenidos en Nicaragua,2021-06-25,"La Corte también resolvió que el Estado de Nicaragua deberá adoptar las medidas necesarias para garantizar la vida, integridad y libertad personal de las cuatro personas identificadas, así como sus núcleos familiares

La Corte Interamericana de Derechos Humanos ordenó el jueves la liberación inmediata de los líderes opositores detenidos en Nicaragua por el gobierno de Daniel Ortega.

La resolución llega en respuesta a una solicitud de la Comisión Interamericana de Derechos Humanos (CIDH) y se ampara en el marco jurídico internacional. El organismo envió una lista donde solicitaban el amparo de líderes opositores detenidos y sus grupos familiares por el grave riesgo que corren en su integridad personal.

La lista no incluyó a Cristiana Chamorro, Arturo Cruz ni al periodista Miguel Mora.

Leer también: Argentina al margen de resolución de la ONU que exige a Nicaragua un proceso electoral libre

De acuerdo con lo dictado por el Tribunal, el Estado de Nicaragua también debe “adoptar sin dilación las medidas necesarias para proteger la vida, integridad personal y salud” de Juan Sebastián Chamorro, José Adán Aguerri Chamorro, Félix Alejandro Maradiaga Blandón, Violeta Mercedes Granera Padilla y sus núcleos familiares.

La Corte además añadió que los hechos adquieren “especial importancia” debido al contexto que se vive en el país centroamericano, el que celebra elecciones generales el próximo noviembre. Señaló que, si la situación persiste, “estaría erosionando las reglas del juego democrático y del Estado de Derecho”.

En “una sociedad democrática los derechos y libertades inherentes a la persona, sus garantías y el Estado de Derecho constituyen una tríada, cada uno de cuyos componentes se define, completa y adquiere sentido en función de los otros”, sentenció.

Las medidas provisionales emitidas por la Corte IDH con sede en Costa Rica tienen carácter vinculante, con lo que el estado nicaragüense estaría en obligación de cumplirlas a cabalidad por ser firmante de la Carta Interamericana.

Leer también: Bachelet en su informe: Arrestos de opositores en Nicaragua supone “graves violaciones de las garantías procesales”

En su petición a la Corte IDH, la comisión explica desde Washington que las personas de la lista para las que pide la protección están procesadas sólo por aspirar a su derecho de participar en las próximas elecciones.

Previo a la resolución de la Corte, el presidente de Nicaragua recalcó, durante un acto oficial, que los opositores arrestados eran «criminales».

«No se trata de precandidatos, sino de criminales que han atacado al país», dijo Ortega, al tiempo que acusó a los presos de ser «agentes del imperio yanqui» que «conspiran contra Nicaragua para derrocar al gobierno». «

«Eso es lo que estamos persiguiendo, eso es lo que se está investigando y eso es lo que se castigará en su momento», afirmó.

Los detenidos enfrentan cargos de «incitación a la injerencia extranjera» en virtud de una nueva ley iniciada por el gobierno de Ortega y aprobada por la legislatura en diciembre que pretendía defender la soberanía de Nicaragua.

La ley ha sido ampliamente criticada como un medio para congelar a los desafiantes y silenciar a los oponentes.

Los arrestos recientes han aumentado la condena internacional.

*Colaboración Armando Gómez desde Costa Rica

Leer también: Sociedad Interamericana de Prensa condena la continua represión en Nicaragua"
