,link,country,news_outlet,title,date,text
24,https://lajornadanet.com/index.php/2017/04/04/ya-hay-nuevo-presidente-del-ine-y-es-el-mayor-general-en-retiro-oscar-salvador-mojica-obregon/,nicaragua,lajornadanet,Ya hay nuevo presidente del INE y es el mayor general en retiro Óscar Salvador Mojica Obregón,2017-04-04,"Ha sido elegido a dirigir la presidencia ejecutiva del Instituto Nicaragüense de Energía (INE) y con 77 votos de los diputados de la Asamblea Nacional, el mayor general en retiro Óscar Salvador Mojica Obregón, en horas de la mañana de hoy martes 4 de abril de 2017.

La propuesta había sido enviada con trámite de urgencia, por el presidente de Nicaragua, Daniel Ortega Saavedra.

Los que votaron por Obregón fueron los 71 legisladores del oficialista Frente Sandinista de Liberación Nacional (FSLN), después los de la bancada Alianza PLI-ALN y el diputado del Partido Conservador (PC), Alfredo César.

Sólo los 14 diputados que tiene la bancada opositora del Partido Liberal Constitucionalista (PLC) prefirieron abstenerse para esta elección, al estimar que fue una propuesta del Ejecutivo, que se vuelve un hecho a sólo 9 días que Mojica fuera retirado del Ejército, en conjunto con el mayor general en retiro Adolfo Zepeda, exinspector general de las fuerzas armadas.

Después de la elección el presidente del Parlamento, el sandinista Gustavo Porras, juramentó al ahora nuevo presidente ejecutivo del INE, Mojica, que sustituye a Carlos Castillo, que pasó más de una década al frente de esta institución."
25,https://lajornadanet.com/index.php/2017/05/22/larios-vocero-de-la-csj-califica-de-levantinas-publicaciones-del-diario-la-prensa/,nicaragua,lajornadanet,Larios vocero de la CSJ califica de “levantinas” publicaciones del Diario La Prensa,2017-05-22,"El Vocero de la Corte Suprema de Justicia, CSJ, doctor Roberto Larios Meléndez, respondió a un Editorial del diario de oposición La Prensa en torno a informaciones dadas sobre la compra de una flota vehicular a los magistrados de la CSJ. Larios califica las informaciones publicadas de “levantinas” , cuando son noticias que no requiere de verificación y son publicadas.

Se refería a una entrevista brindada por el Director Administrativo del Poder Judicial, Berman Martínez al rotativo de la familia Hollman Chamorro. El doctor Roberto Larios Meléndez afirma que “con la publicación inmediata de la transcripción de la entrevista, el Poder Judicial demostró que dicho periódico manipuló y tergiversó la información que de buena fe le fue suministrada, llegando al extremo de poner entre comillas cosas que jamás se le dijeron,” afirma.

He aquí la opinión del vocero de la CSJ, doctor Roberto Larios Meléndez, en torno a publicaciones del Diario La Prensa sobre el poder judicial que dice así íntegramente:

Maldicen la vaca, pero se beben la leche

Roberto Larios Meléndez

Las prácticas difamatorias del diario La Prensa contra el Poder Judicial, se han vuelto una constante. Apenas el pasado 17 de abril, el periódico fue cogido en la mentira cuando quisieron engañar a la opinión pública, desplegando a ocho columnas, con pase adentro de una página completa, un documento que la Corte Suprema de Justicia demostró de inmediato que se trataba de un apócrifo.

Según el diccionario de la Real Academia Española, un apócrifo es “un documento falso, de dudosa autenticidad”, lo que en las salas de redacción del periodismo de antaño se conocía como una “levantina”, la práctica periodística de recoger cualquier chisme en la calle y convertirlo en noticia escandalosa, recurso muy utilizado cuando se caen las ventas del periódico, se busca aumentar la lista de anunciantes, o simplemente desprestigiar a un enemigo político.

La gran “investigación” periodística que provocó semejante despliegue, tenía tantos errores técnicos que no resistía el más elemental análisis crítico; por ejemplo, equivocando los cargos de todos los funcionarios cuyos nombres fueron citados en el reportaje. Error de “primarión”, pues ahora no se necesita ir a la universidad para saber que con una simple consulta web se pueden verificarse los nombres y cargos de cualquier funcionario público.

Pero claro, una “levantina” no requiere verificación.

En aquel caso, La Prensa se quejó de que el Poder Judicial no quiso darles una entrevista sobre el falso “destape”. ¿Qué persona que se precie de seria daría una entrevista sobre un documento falso, que ni siquiera firmas tiene?.

Ahora vuelven al ataque, manipulando una entrevista en la que los datos informados son públicos, pues son parte del Presupuesto General de la República. La Corte Suprema no está ocultando la renovación de su flota vehicular, pero este proceso administrativo, que inició en el año 2015 a través de una licitación pública, es burdamente manipulado por el diario, al afirmar que los magistrados “andan estrenan camionetas del año”, lo cual no solo no tiene nada de malo, ya que todos los altos funcionarios públicos y de la empresa privada andan en “camionetonas”, sino que la especie no es cierta, ya que las camionetas fueron compradas en 2015.

Con la publicación inmediata de la transcripción de la entrevista, el Poder Judicial demostró que dicho periódico manipuló y tergiversó la información que de buena fe le fue suministrada, llegando al extremo de poner entre comillas cosas que jamás se le dijeron.

Como señalábamos al inicio, el problema no iría a más si se tratase de un “error” eventual (aunque sabemos que en política este tipo de “errores” no existen). Si así fuese, se resolvería como quiere el editorialista de La Prensa, “mandando una cartita”, pidiendo una rectificación, la que ya sabemos será publicada en algún oscuro rincón del periódico que nadie se tomará la molestia de mirar.

Pero hacer de la “levantina”, la difamación, la injuria y la calumnia una práctica periodística habitual, cuando no se tienen argumentos para desprestigiar el desempeño exitoso de una institución pública y del gobierno, llega a los extremos en un país que los mismos que realizan esta práctica califican de “dictatorial “ y “antidemocrático”.

Según Google, el Derecho de Réplica es, valga la redundancia, “el derecho de todo individuo para dar su propia versión sobre la información presentada por un medio de comunicación, cuando considera que éste ha deformado hechos o situaciones que le resultan perjudiciales”, como en este caso.

Obviamente, cuando un periódico es pillado mintiendo, es colocado en una situación muy incómoda. Y aunque se trata de un derecho universalmente reconocido, siempre es imposible lograr que este derecho sea reconocido efectivamente por los dueños de los diarios, “en la misma página y con el mismo despliegue con que fue publicada la calumnia”, por muchas “cartitas” que le manden a Don Luis.

El Poder Judicial es una de las instituciones más abiertas y transparentes, sus relaciones con los medios de comunicación son estables y cordiales; en todas las instalaciones judiciales, la Corte Suprema ha creado condiciones para que las y los periodistas sean atendidos con dignidad, facilitándoles el acceso pleno a la cobertura de todos los juicios, incluyendo todo tipo de facilidades para las comunicaciones electrónicas. De hecho, muchos medios tendrían serios problemas sin el apoyo que brindamos a la cobertura de la noticia judicial.

Es algo que parecen no tomar en cuenta los señores de este diario, si observamos que en la edición impresa de este viernes 19 de mayo, mientras denuncian en primera plana que “la CSJ reitera ataques a La Prensa”, más arriba, desplegado a color, está el reportaje del juicio por el incendio del Mercado Oriental, una de las noticias principales del día, con pase a la página 2.

Así que vale la pena preguntarse: “¿cómo que ataques? ¿cómo es que los están “atacando” si les están garantizando la libre cobertura de los juicios?. ¿Cuántos periódicos más vendieron este viernes los Chamorro con esta noticia escandalosa?. Como decimos los nicas, maldicen la vaca, pero se beben la leche."
26,https://lajornadanet.com/index.php/2016/11/29/luis-almagro-de-la-oea-no-se-reunira-con-opositores-pero-si-con-daniel-ortega/#respond,nicaragua,lajornadanet,Luis Almagro de la OEA no se reunirá con opositores pero sí con Daniel Ortega,2016-11-29,"PLC y Frente Amplio están confirmados en el encuentro con la delegación de la OEA, dirigida por Luis Almagro.

Opositores no tan críticos al gobierno del presidente Daniel Ortega Saavedra, los miembros del Partido Liberal Constitucionalista (PLC), sostendrán un encuentro con la delegación que vendrá a Nicaragua de la Organización de Estados Americanos (OEA), los integrantes de dicha comitiva todavía se desconocen.

La OEA viene a Nicaragua a dialogar sobre temas políticos y las elecciones generales del pasado 6 de noviembre, calificadas por la oposición de haber sido una “farsa”, aunque el gobierno diga lo contrario a esto.

La agenda del encuentro es el siguiente: el PLC se sentará con los integrantes de la OEA a las 8am del próximo 5 de diciembre, y después en horas de la tarde el opositor Frente Amplio de Violeta Granera Sacasa, estará sentándose con dicha comitiva.

Fuentes del PLC dijeron a Trinchera de la Noticia que la directiva de este partido se reunieron ayer lunes para acordar puntos, que serán presentados ante la delegación de la OEA.

Se espera este 1ro de diciembre la visita del Secretario General de la OEA, Luis Almagro, él acordó que se reuniría con todos los sectores del país, aunque ayer lunes fue confirmado que sólo se sentará con el presidente Daniel Ortega Saavedra, y no con las demás organizaciones."
27,https://lajornadanet.com/index.php/2016/11/24/nicaragua-responde-a-costa-rica-presencia-militar-en-franja-de-arena-de-harbour-head/,nicaragua,lajornadanet,Nicaragua responde a Costa Rica presencia militar en franja de arena de Harbour Head,2016-11-24,"En la gráfica se puede apreciar la barra de arena que separa la isla Harbour Head del mar Caribe.

A pesar de la dificultad con la tormenta tropical “Otto” que amenaza a Nicaragua y Costa Rica, las diferencias binacionales se mantienen entre estos dos países. Ayer la Cancillería nicaragüense envío una respuesta “oficial” ante los señalamientos del gobierno costarricense.

Los ticos denuncian que las tropas nicas están en la barra de arena que separa la Laguna de Harbour Head del Mar Caribe. La misiva oficial es dirigida al Ministro de Relaciones Exteriores y Culto, Manuel A. González Sanz de Costa Rica.

La carta diplomática es firmada por Denis Moncada Colindres, Ministro Asesor del Presidente de la República para Políticas y Asuntos Internacionales, y dice “la Corte Internacional de Justicia como Costa Rica, han estado en conocimiento pleno de la presencia de un campamento militar nicaragüense en dicha barra desde hace muchos años, independientemente de la ubicación exacta del mismo”.

Agrega la misiva diplomática de Managua redactada por Moncada “tengo a bien recordarle que contrario a lo que Costa Rica alega ha reconocido la soberanía de Nicaragua sobre esa barra frente a la laguna en numerosas ocasiones, más recientemente durante las Audiencias Orales celebradas en Abril 2015. En esa ocasión, Costa Rica recalcó que la ‘barra de arena que separa el mar de la Laguna Harbour Head solamente puede ser considerada como territorio apropiable a un estado mientras el mismo permanezca sobre el agua durante la pleamar, y si esto es así, entonces pertenece a Managua’, y así fue confirmado por la sentencia del 16 de Diciembre de 2015”.

“Por otra parte, como es de su conocimiento y cosnta en los mapas oficiales de Nicaragua y de Costa Rica desde muchos años, ambos países siempre han considerado como parte del territorio Nicaragüense, no solo la barra de arena frente a la Laguna de Harbour Head, sino también el total del estrecho de costa colindante con el Mar Caribe que está entre la Laguna de Harbour Head y la boca del río”, agrega la comunicación.

Indica que “Nicaragua no puede evitar notar la particularidad del momento en que Costa Rica ha decidido realizar este nuevo reclamo, especialmente teniendo en cuenta la próxima visita in situ de los expertos nombrados por la Corte Internacional de Justicia dentro del contexto del caso ‘Delimitación Marítima en el Mar Caribe y el Océano Pacífico’; caso que no abarca este tema y cuya etapa de alegatos escritos ha sido finalizada”, señala el documento.

Todavía San José no responde de manera oficial a la comunicación enviada por Managua, sobre este nuevo conflicto por la barra de arena anexa a Harbour Head."
28,https://lajornadanet.com/index.php/2016/11/25/tras-rechazar-escano-de-diputado-alfredo-cesar-del-partido-conservador-lucha-por-obtenerlo/,nicaragua,lajornadanet,Tras rechazar escaño de diputado Alfredo César del Partido Conservador lucha por obtenerlo,2016-11-25,"Alfredo Cesar ha cedido y ahora pide el escaño de diputado obtenido durante las elecciones pasadas, proceso criticado por el Partido Conservador.

A pesar de haber dicho que no asumiría su escaño como diputado por el Partido Conservador (PC) su presidente Alfredo César cedió, después de haber denunciado ciertas irregularidades ante el Consejo Supremo Electoral (CSE), durante las elecciones del 6 de noviembre de los corrientes.

César cabildea dentro de las estructuras del PC, denunciaron directivos de ese histórico partido político, Melvin Báez y Erik Cabezas Granados, el segundo mencionado fue el candidato presidencial en el proceso electoral pasado.

“Él está maniobrando en el partido y como ya es un señor de edad y no hay reelección él quiere irse premiado con diputación y con plata. Él está acostumbrado a maniobrar y le dimos un voto de confianza, pero este señor es traidor”, criticó Cabezas, que funge en la actualidad como secretario político del PC.

Para Melvin Báez, también directivo del PC, señaló que César “ahora cambia sus palabras y contexto”, cuando la directiva le ha dicho que no tiene que asumir dicho escaño.

“Si nosotros somos un partido de oposición y que criticamos que este CSE es corrupto y que viola los derechos de sus electores y elegidos, no es correcto que ese escaño se ocupe, pero Alfredo César está haciendo movidas ilegales y está violando los principios y valores como partido. Nosotros cerramos filas de que no se debe asumir porque no somos ni queremos que nos vean como partido zancudo”, aseguró Báez.

Para César, sobre las críticas de sus compañeros del PC, dijo que en su partido se lleva a cabo la democracia y la libertad de opinión.

“No hay ninguna maniobra y Melvin Báez estuvo de acuerdo con convocar al Consejo Nacional que fue por unanimidad y es ese organismo el que tomará la decisión sobre el escaño del PC, porque la mayoría manda”, manifestó César, tras decir días atrás que no aceptaría el escaño por haber visto anomalías en los comicios del mes de noviembre."
29,https://lajornadanet.com/index.php/2017/05/24/pediran-al-poder-electoral-observar-elecciones-municipales/#respond,nicaragua,lajornadanet,Pedirán al Poder Electoral observar elecciones municipales,2017-05-24,"Ética y Transparencia dice que aunque no ha recibido invitación, pedirá su participación oficial al gobierno para observar elecciones

Roberto Courtney director de Ética y Transparencia, afirmó que el ambiente que se vive actualmente en relación con las elecciones municipales que se llevarán a cabo el próximo 5 de noviembre, son bastante parecidas a las de las votaciones nacionales del 2016, momento que según expertos calcularon un 70% de abstención electoral, debido a que no hubo credibilidad en el Consejo Supremo Electoral (CSE).

La enorme cantidad de críticas hechas de diferentes partidos opositores debido a que los organismos internacionales no han sido notificados para observar las elecciones municipales, ha causado que el organismo de Ética y Transparencia (EyT) este impulsando su participación para ser observadores en las elecciones.

Informó Courtney ayer martes 23 de mayo que pedirá formalmente su acreditación al CSE, aunque en procesos electorales pasados fueron excluidos.

En las elecciones presidenciales del 2016, el gobierno de Daniel Ortega no aceptó observación electoral nacional y anuló la participación a los organismos de observación electoral internacional, tildándolos de ser “sinvergüenzas”.

Courtney explicó que a pesar de la posibilidad que la Organización de Estados Americanos participen como observadores en las elecciones municipales, ni el gobierno ni el CSE han hecho campañas para mejorar la credibilidad del proceso electoral.

El director de EyT dice que el proceso de observación que realizará de “cada ciudadano, un observador”, pero al mismo tiempo tienen un equipo de expertos en el tema electoral, alrededor 500, que recopilarán información sobre los diferentes aspectos del proceso.

No obstante las amenazas de una iniciativa de Ley en el Congreso de Estados Unidos, que castigaría al gobierno de Daniel Ortega por las supuestas irregularidades a los deberes democráticos y a los derechos Humanos, provocó que el gobierno firmara un acuerdo con la OEA, para tratar de impedir la aprobación de esta ley conocida como Nica Act.

El consorcio de organizaciones nombrado como “Panorama Electoral”, integrado por Ética Y Transparencia, el Instituto de Liderazgo de las Segovias, El Movimiento de Mujeres de Chinandega y la Asociación de Voluntarios para el desarrollo, próximamente entregarán diversos informes fundamentados en la recopilación de datos obtenida de la observación esto de ser posible cumplir con la misión de participar en las municipales."
90,https://lajornadanet.com/index.php/2017/08/24/rosario-murillo-afirma-que-no-hubo-dedazo-para-escoger-candidatos-dentro-del-fsln/,nicaragua,lajornadanet,Rosario Murillo afirma que no hubo “dedazo” para escoger candidatos dentro del FSLN,2017-08-24,"Todavía no hay una posición oficial del partido en el gobierno Frente Sandinista de Liberación Nacional (FSLN), ante las coberturas de prensa en medios independientes que publican hay protestas de militantes de ese partido, en cuanto a la escogencia de los candidatos a alcaldes, vicealcaldes y concejales en los municipios de Masaya, Chinandega, Nueva Segovia y Madriz.

La vicepresidenta de Nicaragua, Rosario Murillo Zambrana, manifestó que más de 600 mil integrantes del sandinismo fueron participes con las encuestas a través de las cuales el Congreso del FSLN, giró la orden de escoger a los candidatos en los 153 municipios de este país centroamericano.

“Se están haciendo entrevistas con los candidatos, las candidatas, que en una cantidad de municipios de nuestro país resultaron aprobados, respaldados, por las familias nicaragüenses, en todos los municipios, se hicieron las encuestas, como hemos explicado, más de 600 mil personas participaron y bueno, resultaron con más aprobación aquellas personas, mujeres y hombres, que fueron inscritos el día viernes en el Consejo Supremo Electoral”, dijo Murillo, aunque no se sabe si esto fue para aclarar a los de su partido dicha escogencia.

En el diario La Prensa fue publicado un artículo que aseguró un grupo de unos 300 militantes sandinistas en el municipio San Juan de Río Coco, del departamento de Madriz, rechazan la candidatura del alcalde Asisclo Laguna Mairena, que apunta a reelegirse a un tercer período.

Leer también: La lista de los municipios que rechazan a candidatos establecidos por dirigencia del FSLN

Además en los medios independientes se informa que hay otros plantones y manifestaciones del FSLN en Jalapa (Nueva Segovia) y en Niquinohomo (Masaya), donde se rechaza a los candidatos.

Murillo dijo sobre la selección de los candidatos que fue una “consulta directa con la población” a través de las encuestas.

Aunque los nombres de los más de 6,088 candidatos a alcaldes, vicealcaldes y concejales han sido inscritos ante el Consejo Supremo Electoral (CSE), estos no se revelaron, sino se deberá esperar cuando el 19 de septiembre sean publicados los candidatos en el diario oficial La Gaceta.

Las elecciones municipales ocurrirán en Nicaragua para el próximo 5 de noviembre, donde serán escogidas las nuevas autoridades municipales del país en las 153 alcaldías existentes."
91,https://lajornadanet.com/index.php/2017/09/25/empresario-nicaraguense-envia-carta-a-presidente-congreso-eeuu-para-no-aprobar-ley-nica-act/#comments,nicaragua,lajornadanet,Empresario nicaragüense envía carta a presidente Congreso EEUU para no aprobar Ley Nica Act,2017-09-25,"Por el momento no hay ninguna respuesta del presidente del Congreso de Estados Unidos, Paul Ryan, tras la carta enviada por empresario nicaragüense Roberto Argüello

El viernes de la semana pasada el empresario nicaragüense Roberto Argüello, redactó una carta dirigida al presidente del Congreso de Estados Unidos, Paul Ryan, solicitándole que no se apruebe la Ley Nica Act, pues esto estaría ocurriendo antes que finalice septiembre, sino durante el próximo mes de octubre.

Esta sería la primera apelación ante la reacción del anuncio hecho por el Senador Marco Rubio y la congresista Ileana Ros-Lehtinen, que afirman se mantendrán con sus planes de obtener la aprobación de este reglamento, que afectaría fuertemente la economía nicaragüense, según fuentes de sectores empresariales y políticos de este país centroamericano.

«La Comunidad Nicaragüense-Americana, que cuenta con aproximadamente un millón de miembros… está muy preocupada con los efectos devastadores para la economía», dice el comienzo de la misiva.

A Ryan, el banquero nicaragüense Argüello, le pide la oportunidad de lograr el acuerdo entre la OEA y el gobierno del presidente Daniel Ortega Saavedra, de cara a la observación de las elecciones municipales que serán en el mes de noviembre.

Leer también: Primeras críticas al envío de la misión de observación electoral de la OEA

El banquero le explica a Ryan que el acuerdo «es un paso significativo para darle transparencia» a los comicios y que esta vía «hará innecesario destruir la economía» de esta nación centroamericana.

Para el empresario, de aprobarse la Ley Nica Act, la economía nicaragüense se volverá un caos y estará convirtiendo este país en una segunda Venezuela.

Dice que además de los empresarios, las familias nicaragüense se encuentran con bastante preocupación ante la posible aprobación de la Nica Act, causando a que Ortega llegue a tomar medidas más represivas contra las libertades civiles.

Junto a la firma de Roberto Argüello está la de Arturo Estopiñán, presidente de The Estopiñan Group, que es la firma de cabildeo que trabaja para el empresario en este tema.

Leer también: Propuesta completa de lo que dice la Ley Nica Act – Traducción no oficial"
