,link,country,news_outlet,title,date,text
101,https://lajornadanet.com/index.php/2017/05/24/pediran-al-poder-electoral-observar-elecciones-municipales/,nicaragua,lajornadanet,Pedirán al Poder Electoral observar elecciones municipales,2017-05-24,"Ética y Transparencia dice que aunque no ha recibido invitación, pedirá su participación oficial al gobierno para observar elecciones

Roberto Courtney director de Ética y Transparencia, afirmó que el ambiente que se vive actualmente en relación con las elecciones municipales que se llevarán a cabo el próximo 5 de noviembre, son bastante parecidas a las de las votaciones nacionales del 2016, momento que según expertos calcularon un 70% de abstención electoral, debido a que no hubo credibilidad en el Consejo Supremo Electoral (CSE).

La enorme cantidad de críticas hechas de diferentes partidos opositores debido a que los organismos internacionales no han sido notificados para observar las elecciones municipales, ha causado que el organismo de Ética y Transparencia (EyT) este impulsando su participación para ser observadores en las elecciones.

Informó Courtney ayer martes 23 de mayo que pedirá formalmente su acreditación al CSE, aunque en procesos electorales pasados fueron excluidos.

En las elecciones presidenciales del 2016, el gobierno de Daniel Ortega no aceptó observación electoral nacional y anuló la participación a los organismos de observación electoral internacional, tildándolos de ser “sinvergüenzas”.

Courtney explicó que a pesar de la posibilidad que la Organización de Estados Americanos participen como observadores en las elecciones municipales, ni el gobierno ni el CSE han hecho campañas para mejorar la credibilidad del proceso electoral.

El director de EyT dice que el proceso de observación que realizará de “cada ciudadano, un observador”, pero al mismo tiempo tienen un equipo de expertos en el tema electoral, alrededor 500, que recopilarán información sobre los diferentes aspectos del proceso.

No obstante las amenazas de una iniciativa de Ley en el Congreso de Estados Unidos, que castigaría al gobierno de Daniel Ortega por las supuestas irregularidades a los deberes democráticos y a los derechos Humanos, provocó que el gobierno firmara un acuerdo con la OEA, para tratar de impedir la aprobación de esta ley conocida como Nica Act.

El consorcio de organizaciones nombrado como “Panorama Electoral”, integrado por Ética Y Transparencia, el Instituto de Liderazgo de las Segovias, El Movimiento de Mujeres de Chinandega y la Asociación de Voluntarios para el desarrollo, próximamente entregarán diversos informes fundamentados en la recopilación de datos obtenida de la observación esto de ser posible cumplir con la misión de participar en las municipales."
102,https://lajornadanet.com/index.php/2017/05/18/campesinos-opuestos-al-canal-interoceanico-anuncian-dos-protestas-mas/#respond,nicaragua,lajornadanet,Campesinos opuestos al Canal Interoceánico anuncian dos protestas más,2017-05-18,"Francisca Ramírez, líder del Movimiento Campesino Anticanal informó ayer miércoles 17 de mayo se programaron dos marchas para el mes de junio, en donde se convocó a miles de campesinos para marchar como modo de protesta en contra del Canal Interoceánico. Los agrarios aducen que su lucha no va a terminar hasta que sea abolida la Ley 840.

Los campesinos provenientes de la zona de La Fonseca, Punta Gorda, Puerto Príncipe y más de cien comunidades vecinas, se organizan para llevar a cabo la marcha numero 88 el próximo 10 de junio en el Polo de Desarrollo o Punta Gorda, dijo Ramírez.

La lucha que han mantenido es debido a la posible expropiación de sus tierras para construir este canal. Tal lucha ha sido durante cuatro años y en una forma de celebración a ese tiempo de lucha establecieron las marchas 88 y 89 que llevarán a cabo en el Polo de Desarrollo Daniel Guido y en la comunidad El Dorado, en El Tule.

“Organizamos las marchas 88 y 89 en las zonas por donde el gobierno dice que pasará el Canal y estas marchas son como un homenaje a los cuatro años de lucha que hemos llevado a cabo con todo y represión”, “Nosotros libramos una lucha por nuestras tierras.” Nuestra lucha no es sujeta a ningún acuerdo más que se nos respeten nuestros derechos”, manifestó Ramírez.

Medardo Mairena quien fue nombrado recientemente Coordinador del Movimiento Campesino, aclaró que las marchas que hacen los campesinos, no tiene ningún trasfondo político. “Nuestro único interés por estas marchas es por la defensa de nuestras tierras, el único patrimonio para nuestros hijos. No tenemos pensado rendirnos por esta lucha hasta que Daniel Ortega borre esa Ley 840”.

Mairena informó que la marcha del próximo 13 de junio está programada para llevarse a cabo en la comunidad El Dorado, en el municipio de El Tule, zona donde está previsto por el gobierno construirá la mega obra canalera y que su iniciación no ha comenzado todavía.

Según menciona Mairena la Ley 840 pone en peligro sus propiedades y dice que los campesinos están defendiendo su derecho de proteger sus tierras si es posible luchar hasta la muerte. “No pensamos dar ni un paso atrás”, explicó Mairena.

Ambos líderes dicen que sus protestas son reprimidas por las autoridades gubernamentales pero confían que no tratarán de impedir estas marchas en esta ocasión."
103,https://lajornadanet.com/index.php/2016/11/08/resultado-elecciones-generales-de-nicaragua-aceptado-por-cerrato-candidato-aln/#respond,nicaragua,lajornadanet,Resultado elecciones generales de Nicaragua aceptado por Cerrato candidato ALN,2016-11-08,"Todavía el PLC ni el PLI acepta lectura de resultados presentada por el Poder Electoral.

El primer candidato que acepta los resultados de las elecciones generales del pasado 6 de noviembre es el evangélico Saturnino Cerrato, quien corrió como candidato por la Alianza Liberal Nicaragüense (ALN).

Cerrato aceptó el porcentaje presentado por el Consejo Supremo Electoral (CSE) que dio a Ortega el 72.5% de votos a favor. “Aceptamos esos resultados”, dijo el político evangélico, quien aspiraba a ser el triunfador en los comicios electorales.

“Esperaba mucho más, pero así ocurrió y simplemente es parte de este accionar que como he dicho que cuando hay gobierno autoritarios e intimida la gente tiene temor y mejor deciden ‘no, no voy ir a votar’ y por eso se abstienen”, dijo el candidato que lamenta la abstención que hubo, pues para él fue mayor que la anunciada por el CSE.

El ALN de Cerrato logró el 4.3% de votos a nivel nacional. El reverendo espera haber ganado 4 diputaciones, 2 para la Asamblea Nacional de Nicaragua y las otras 2 en el Parlamento Centroamericano.

Leer también: 2 partidos políticos PLC ni el PLI han aceptado triunfo electoral de Daniel Ortega"
104,https://lajornadanet.com/index.php/2017/08/16/nicaragua-saluda-a-ecuador-por-fecha-patria/#respond,nicaragua,lajornadanet,Nicaragua saluda a Ecuador por fecha patria,2017-08-16,"Nicaragua saludó al pueblo y gobierno de Ecuador, a propósito de conmemorarse el aniversario 208 del grito de independencia de la nación sudamericana.

‘Nuestro saludo fraternal al hermano pueblo de Ecuador y a su gobierno en esta fecha tan importante, donde conmemoramos independencia, comprometemos y fortalecemos la unidad de Nuestra América por la paz, la justicia y el desarrollo’, expresó la vicepresidenta nicaragüense, Rosario Murillo.

Asimismo, informó, el canciller, Denis Moncada, transmitirá a las autoridades ecuatorianas el saludo del presidente, Daniel Ortega, durante un concierto homenaje por la efeméride.

Cada año Ecuador celebra por estas fechas los hechos acaecidos en 1809, cuando un grupo de patriotas conformaron la Junta Soberana de Quito, tras conocer la abdicación del rey español Fernando VII producto de la invasión napoleónica.

Aunque la República del Ecuador quedó constituida formalmente el 13 de mayo de 1830, tras su separación de la Gran Colombia fundada por Simón Bolívar, los ecuatorianos suelen evocar ese acontecimiento como su primera declaración de independencia."
105,https://lajornadanet.com/index.php/2017/03/31/embajadora-eeuu-lamenta-destitucion-de-secretaria-municipal-san-juan-del-sur-por-una-foto/,nicaragua,lajornadanet,Embajadora EEUU lamenta destitución de secretaria municipal San Juan del Sur por una foto,2017-03-31,"Habló la embajadora de Estados Unidos en Nicaragua, Laura Dogu, sobre el despido de la secretaria municipal de San Juan del Sur, Heidy Auxiliadora Herrera Obando, por supuestamente haberse tomado una fotografía con ella.

“Es una lástima que si una persona ha trabajado por su país y para su comunidad, y ha perdido toda la oportunidad de mejorar la situación de su comunidad sólo por tomarse una foto conmigo”, dijo Dogu, sobre el supuesto despido a Herrera Obando.

Aclaró desconocer a la ahora ex funcionaria y sostener contacto con ella. “No la conozco a ella. Obviamente yo pasé por esa biblioteca de San Juan del Sur para una donación de libros para niños acá en Nicaragua y (nos) tomamos unas fotos. Además de eso no tengo contacto con ellos acá en Nicaragua, es una lástima”, dijo la diplomática a los periodistas.

Según medios de prensa nacionales Heidy Auxiliadora Herrera Obando es destituida la noche del lunes pasado, durante una sesión de urgencia que fue convocada con los concejales del Frente Sandinista de San Juan del Sur, un funcionario del regional del Instituto Nicaragüense de Fomento Municipal (Inifom) y un dirigente sandinista departamental, dijeron a través de fuentes anónimas del mismo partido en el gobierno.

Aclara que nunca fue destituida

A Herrera la hacen firman una carta de renuncia redactada por otros ese mismo lunes, en la misma ella se iba por problemas familiares, a lo que la ex concejal de San Juan del Sur descartó haber firmado la carta, aclarando que no ha cometido ninguna irregularidad para ser destituida.

Ni siquiera tenía mucho de estar en el cargo, pues el pasado 13 de marzo fue ubicada en ese puesto de secretaria del Concejo Municipal por los concejales sanjuaneños oficialistas y opositores, sustituyendo a quien fuera secretario José María Guadamuz Vasconcelos, también destituido.

Supuestamente Herrera Obando fue defenestrada porque el pasado jueves 23 de marzo se tomó una fotografía donde aparece con Laura Dogu, y el personal de la Biblioteca Móvil de San Juan del Sur, y la foto fue subida al perfil de Facebook de la Biblioteca Móvil.

¿Crees que realmente Herrera Obando fue destituida por aparecer en una fotografía con la Embajadora de Estados Unidos?"
106,https://lajornadanet.com/index.php/2016/11/03/escandalo-ha-sido-la-renuncia-de-primera-candidata-a-diputada-por-el-pli/#comments,nicaragua,lajornadanet,Escándalo ha sido la renuncia de primera candidata a diputada por el PLI,2016-11-03,"A escasos días de las elecciones presidenciales, ha sido bastante sonado el hecho que Cristiana Rodríguez, decidiera renunciar a su candidatura por el PLI.

Ha sido un verdadero escándalo la renuncia de la primera candidata a diputada por el Partido Liberal Independiente (PLI) en Carazo, Cristiana Rodríguez, pero ella aseguró su nombre estará en esa lista debido a que el periodo de excusión han finalizado.

“Desde meses atrás yo quería hacer esto, pero diferentes circunstancias, motivos influyeron en esta decisión. La obstaculizaron desde un inicio. Pero realmente siento que esto no es algo limpio ni transparente, y no me sentía en condiciones de seguir más en esto. Desde un inicio quise hacerlo, pero como bien repito, una persona se acercó a mí, me obstaculizó mi decisión, engañándome”, detalló Rodríguez.

Rodríguez se negó a dar el nombre de la persona que le impedía renunciar a su cargo como diputada nacional, provocando aún más fuerte este escándalo político noticioso, a pocos días de las elecciones del 6 de noviembre.

“Ahorita yo quiero indagar con mi representante legal, que es José Manuel Gutiérrez, representante allá en Carazo, (con) quien tuve la oportunidad de estar con él en Carazo ayer en la tarde y entregarle las credenciales de todos los fiscales de Carazo. Una vez que constate con él y que tenga fundamentos (…) voy a dar mis declaraciones públicas, por el momento, lo dejo así”, dijo Mario Asensio, representante legal del PLI.

“Al analizar la Ley Electoral (Ley 331), nos encontramos que el sistema conformado para estas elecciones es completamente contradictorio a dicha Ley. Todo el escenario es orquestado por el FSLN. En los CED, CEM, JRV no tenemos miembros ni fiscales, asimismo en los centros de cómputo no tenemos fiscales”, dijo la excandidata a diputada en su carta de renuncia."
107,https://lajornadanet.com/index.php/2017/11/03/cardenal-brenes-llama-a-reflexionar-de-cara-a-las-elecciones-municipales/,nicaragua,lajornadanet,Cardenal Brenes llama a reflexionar de cara a las elecciones municipales,2017-11-03,"Un llamado a la reflexión durante el denominado silencio electoral a los ciudadanos nicaragüenses, hizo el Arzobispo Metropolitano de Managua, Cardenal Leopoldo Brenes, y a la vez a actuar de manera responsable cuando en Nicaragua se celebren las elecciones municipales del próximo domingo 5 de noviembre.

El alto líder religioso afirma que él ha estado orando para este proceso electoral, pero según el portal de 100% Noticias, no respondió a la pregunta sobre si estará participando a depositar su voto por alguno de los candidatos.

Leer también: Conferencia Episcopal de Nicaragua se pronuncia sobre las elecciones municipales

Recientemente la Conferencia Episcopal de Nicaragua (CEN) lanzó su advertencia durante una ceremonia religiosa al decir que “las problemáticas en material (electoral), siguen siendo las mismas”, estas fueron señaladas en un documento entregado al mandatario nicaragüense Daniel Ortega durante una reunión que hubo de forma privada el 21 de mayo de 2014.

El líder de la Iglesia Católica de Nicaragua fue consultado en los últimos comicios presidenciales y le habían preguntado si votaría, a lo que respondió que “pediría dirección al Espíritu Santo”, pero al final llegó a las urnas a ejercer su derecho al voto.

Leer también: Triunfo inobjetable del FSLN se proyecta sobre el escenario electoral"
108,https://lajornadanet.com/index.php/2017/05/19/24-de-mayo-eeuu-discute-amenazante-ley-nica-act-que-afectaria-economia-de-nicaragua/#respond,nicaragua,lajornadanet,24 de mayo EEUU discute amenazante Ley Nica Act que afectaría economía de Nicaragua,2017-05-19,"Los congresistas Ileana Ros-Lehtinen y Albio Sires se mantienen activos promoviendo esta iniciativa de Ley, que amenaza la economía nicaragüense de aprobarse

Nicaragua está en riesgo de ser fuertemente sancionada de manera económica si el Senado de los Estados Unidos aprueba la de Ley Nicaraguan Investment Conditionality Act (Nica Act, H.R. 1819), mejor conocida como Ley Nica Act.

Se supo que el Subcomité del Hemisferio Occidental de la Cámara de Representantes realizó un llamado para que la semana entrante integrantes del Comité de Relaciones Exteriores discutan la iniciativa de Ley.

La fecha del encuentro es para el próximo 24 de mayo, y estarán discutiendo diversos temas, entre los dos principales están Venezuela y Nicaragua. Para este país centroamericano de ser activa la Ley Nica Act, afectaría enormemente el desarrollo económico de esta nación, han dicho centros de estudios económicos.

Las dos discusiones del Comité de Relaciones Exteriores son sobre la Ley H. Res. 259 que condena la actual crisis política, económica, social y humanitaria en Venezuela; y la H.R. 1819, conocida como Nica Act.

Los congresistas Ileana Ros-Lehtinen y Albio Sires, con el copatrocinio de 23 legisladores, están promoviendo este reglamento de alto riesgo económico para Nicaragua.

Después que sea aprobada, la iniciativa de Ley ingresaría al Comité de Relaciones Exteriores, entonces en el pleno de la Cámara de Representantes. De ser aprobado este reglamento los EEUU votaría contra cualquier préstamo al gobierno de Nicaragua ante los entes internacionales multilaterales.

Hay dos versiones de la Nica Act conocidas como la vieja y la nueva. La primera aprobada por la Cámara de Representantes el mes de septiembre del año 2016. Mientras que la segunda viene más fuerte, ordena a Ortega hacer cambios sustanciales y que sean realizados para restaurar democracia, combate a la corrupción, derechos humanos, periodistas, sindicalistas y la libre movilidad de partidos políticos opositores. La ley anterior sólo exigía respeto tanto a los organismos de la sociedad civil como a partidos políticos.

Nuevamente la congresista del ala republicana Ros-Lehtinen, cuando intervino el pasado miércoles de esta semana, hizo púbico su respaldo a la resolución 145, para que el Gobierno de Estados Unidos apoye la lucha contra la corrupción en Centroamérica, bajo los ataques de las drogas y el crimen organizado.

La política señaló los supuestos retrasos en lo político en Nicaragua y de las razones de impulsar la Ley Nica Act."
109,https://lajornadanet.com/index.php/2018/01/10/ni-el-canciller-de-nicaragua-ni-diputados-hablan-de-las-sanciones-a-roberto-rivas-reyes/,nicaragua,lajornadanet,Ni el Canciller de Nicaragua ni diputados hablan de las sanciones a Roberto Rivas Reyes,2018-01-10,"Ningún funcionario o político de alto nivel que rodea el poder del gobierno de Nicaragua se ha pronunciado sobre las severas sanciones a Roberto Rivas Reyes, por parte de los Estados Unidos

No quiso hacer comentarios el canciller de la República, Denis Moncada Colindres, sobre las sanciones que activó los Estados Unidos al magistrado presidente del Consejo Supremo Electoral (CSE), Roberto Rivas Reyes.

Colindres apareció ayer en horas de la mañana en las instalaciones de la Asamblea Nacional para ser parte de la sesión inaugural del parlamento, entonces fue recibido por periodistas de varios medios de comunicación que le preguntaron sobre las sanciones a Rivas Reyes.

Moncada no hizo ninguna referencia, más que decirle a los comunicadores que él había sido invitado a la sesión inaugural de la Asamblea Nacional. A pesar de la insistencia de los periodistas dijo desconocer el caso.

Tampoco diputados oficialistas hablan del caso

De momento ninguno de los diputados de la bancada del Frente Sandinista de Liberación Nacional (FSLN) ha hablado de la situación que enfrenta Roberto Rivas Reyes, en cuanto a la sanción de los Estados Unidos bajo la ley Magnitsky.

A Rivas Reyes los Estados Unidos lo señalan de corrupción y violación de los derechos humanos, después de recibir señalamientos de críticos al gobierno de Daniel Ortega. Se desconoce si el presidente del CSE dejara su cargo.

Lo único que se sabe es que Lumberto Campbell, actual vicepresidente del CSE, sería el que asumiría el cargo de Rivas Reyes, pues él fue la representación máxima durante la entrega de credenciales y juramentación de las nuevas autoridades edilicias."
110,https://lajornadanet.com/index.php/2017/08/14/gobierno-de-daniel-ortega-rechaza-amenaza-de-donald-trump-hecha-a-venezuela/,nicaragua,lajornadanet,Gobierno de Daniel Ortega rechaza amenaza de Donald Trump hecha a Venezuela,2017-08-14,"El gobierno de Nicaragua, dirigido por Daniel Ortega, redactó un comunicado donde rechaza las amenazas realizadas por los Estados Unidos de América, representado por Donald Trump, donde prácticamente hace una amenaza de guerra a la administración de Nicolás Maduro de Venezuela.

“Nuevamente la voz de los Imperios se manifiesta contra Nuestraméricalatinacaribeña. Las amenazas de ayer, y las amenazas de hoy, son las mismas”, dice la misiva del gobierno nicaragüense.

“Nuestramérica, que está hecha de Vigor y de Gloria, que está hecha para la Dignidad, se alza en reclamo urgente de Respeto y, sobre todo, en exigencia de reconocer el Derecho de nuestros Pueblos a la Paz, a la Seguridad, y a Modelos propios para el Desarrollo Político, Económico y Social”, agrega el comunicado.

“Nos unimos al Clamor de los Pueblos de Nuestraméricacaribeña, que exigimos Paz y Unidad, y al Gobierno y Pueblo de Venezuela renovamos nuestra infinita Solidaridad y Cariño, condenando en nombre de la Dignidad y Orgullo Soberano del Pueblo de Augusto C. Sandino, todos los atropellos contra la Patria de Bolívar, de Chávez, del Presidente Nicolás”, agrega.

“Nicaragua, que conoce de Conflictos y Diálogos, se pronuncia una vez más por todo lo que contribuya a abrir puertas para la Reflexión, la Discusión y el Entendimiento, indispensables para la Paz”, dice la proclamación del gobierno de Ortega."
111,https://lajornadanet.com/index.php/2017/05/29/nicaragua-fue-dotada-con-novedoso-sistema-antimisiles-ruso/,nicaragua,lajornadanet,¿Nicaragua fue dotada con novedoso sistema antimisiles ruso?,2017-05-29,"Aunque la fuente noticiosa no lo detalla, el acercamiento entre Rusia y Nicaragua podría ser un indicio de que así fue

El medio digital especializado en temas variados de Rusia, Sputnik, publicó que este país euroasiático vendió sus sistemas antimisiles de abordo President-S a tres diferentes naciones, reveló Vladímir Mijéyev, representante del consorcio Tecnologías Radioelectrónicas (KRET), quien no detalla las mencionadas naciones.

Aunque Nicaragua no está señalada, el alto representante ruso manifestó que tras el negocio realizado, se tienen pláticas para suministrar a clientes de África, la región Asia-Pacífico y América Latina.

Tras esta noticia publicada por esta agencia rusa, surge la gran pregunta sobre si Rusia ha dotado al Ejército de Nicaragua con este novedoso sistema, por ser el presidente Daniel Ortega Saavedra, gran amigo del mandatario Vladimir Putin.

«Los suministros a varios países están en progreso: hemos cumplido nuestras obligaciones de instalar los sistemas (Richag-AV) en nuestros Mi-17 y Mi-8 de diferentes modificaciones, y en algunos casos las obras se llevaron a cabo en territorio extranjero», dijo Mijéyev.

President-S es un sistema de defensa que permite detectar automáticamente las amenazas a las naves aéreas que lo portan, así como tomar las contramedidas necesarias para invalidar el ataque. Es capaz de neutralizar los misiles tierra-aire así como sistemas portátiles de defensa antiaérea, explica Sputnik.

Agrega: Permite detectar y rastrear misiles del enemigo con un rayo láser multiespectral para desactivar su sistema de guiado. Así, emite interferencias infrarrojas y de radioondas interrumpiendo el guiado de los misiles.

Al comentar el inicio de la producción de estos sistemas en 2015, el subjefe de KRET, Ígor Nasenkov, subrayó que President-S es capaz de proteger cualquier avión, concluye la información de este medio digital ruso."
112,https://lajornadanet.com/index.php/2017/05/12/ortega-dice-que-ejercito-es-fundamental-para-garantizar-la-paz-en-anos-electorales/#respond,nicaragua,lajornadanet,Ortega dice que Ejército es fundamental para garantizar la paz en años electorales,2017-05-12,"Durante una ceremonia el presidente de Nicaragua, Daniel Ortega Saavedra, ascendió a grado militar de Mayor General a los Generales de Brigada Bayardo Rodríguez y Marvin Corrales y habló sobre la estabilidad que tiene este país centroamericano. Señaló que las Fuerzas militares son clave para mantener la paz de cara a las elecciones municipales que se realizarán este año.

Sobre la agenda de las municipales, que están siendo criticadas por los opositores de los dos partidos mejor organizados del país, los Ciudadanos por la Libertad (CxL) y del Partido Liberal Constitucionalista (PLC) por no incluir la observación electoral nacional e internacional, Ortega habló al respecto, y apoya estas actividades a pesar que no contengo dentro nada que se refiera a observadores.

“Ya el Consejo Supremo Electoral (CSE) marcó el punto de partida de las Elecciones Municipales y ustedes ya están participando de ese esfuerzo para garantizar y apoyar que este proceso electoral sea un proceso electoral en paz y en tranquilidad, y que se puedan llenar todas las demandas que tiene un proceso electoral, que parecieran simples como es llevar las boletas, pero lo difícil que es llevar las boletas a lugares totalmente recónditos”, dijo el mandatario.

Habló también de lo difícil de las batallas a narcotráfico, el crimen organizado y el terrorismo, que tienen mecanismos más complejos.

“Difícil de enfrentar no por nosotros, porque con nuestros esfuerzos logramos mantener aquí un oasis de estabilidad, de seguridad, en la región y en el mundo; sino para las potencias, para las potencias que tienen el poder militar más grande en el planeta, que tienen los mayores y mejores recursos de inteligencia, de seguridad, que tienen la más avanzada tecnología de punta que se pudiese haber imaginado la especie humana que se iba a llegar a desarrollar”, explicó."
